{
  "contract_version": "1.0.0",
  "coverage": [
    {
      "edition_id": "delitzsch",
      "reason": "Outside this pilot selection",
      "status": "not_requested"
    },
    {
      "edition_id": "oe",
      "reason": "Pinned pilot passage",
      "status": "present"
    },
    {
      "edition_id": "sblgnt-tagnt",
      "reason": "Outside this pilot selection",
      "status": "not_requested"
    },
    {
      "edition_id": "tth-es",
      "reason": "No Daniel book in the existing TTH mapping",
      "status": "absent"
    }
  ],
  "diagnostics": [],
  "input_manifest_digest": "c76ee34825d2db69c93aa847b0e08ed8b10459222e91608a225088c927f97981",
  "records": {
    "concepts": [
      {
        "id": "shaul:concept:son-of-man",
        "kind": "concept",
        "names": {
          "es": "Hijo del Hombre"
        },
        "owner": "shaul",
        "provenance": {
          "locator": {
            "kind": "yaml",
            "pointer": ""
          },
          "origin": "authored",
          "publication": "draft",
          "review": "unreviewed",
          "source_id": "source:shaul-son-of-man",
          "transformation": "normalized",
          "visibility": "public"
        },
        "source_record": {
          "aliases": [
            "Hijo del Hombre",
            "Ben Ha'Adam",
            "Ben HaAdam",
            "Bar Enash"
          ],
          "articles": [
            {
              "path": "besorah/marcos_ben_adam_metamorfosis_glosario",
              "title": "Marcos: Ben Adam, metamorfosis y glosario mesiánico"
            },
            {
              "path": "besorah/marcos_hijo_elohim_hijo_hombre_herencia",
              "title": "Marcos: Hijo de Elohim, Hijo del Hombre y herencia"
            },
            {
              "path": "besorah/marcos_14_pesaj_pacto_getsemani_juicio",
              "title": "Marcos 14: Pésaj, pacto renovado, Getsemaní y el juicio"
            },
            {
              "path": "temas/ben_hijo_titulos_mesias",
              "title": "Ben, Adam y el Hijo dado al Mesías"
            }
          ],
          "description": "Un concepto experimental que reúne formas lingüísticas y menciones intertextuales sin borrar su especificidad léxica.",
          "forms": [
            {
              "role": "aramaic_expression",
              "word": "word:bar-enash-ar"
            },
            {
              "role": "hebrew_expression",
              "word": "word:ben-ha-adam-he"
            }
          ],
          "id": "son-of-man",
          "names": {
            "es": "Hijo del Hombre"
          },
          "related_concepts": [
            "concept:son"
          ],
          "summary": {
            "what_it_is": "Hijo del Hombre reúne el בן האדם — Ben HaAdam de Marcos con el בר אנש — Bar Enash de Daniel 7. Daniel ve a uno como hijo de hombre después de las bestias y le son dados dominio, honra y reino; Marcos une el Ben HaAdam con padecimiento, muerte, resurrección y venida en nubes. El concepto también se lee dentro de la pregunta adámica: el Mesías es el Hombre de arriba, en quien la vocación y el dominio destinados al hombre llegan a su cumplimiento.",
            "what_it_is_not": "No es simplemente una manera de decir que Yeshua era humano, ni una etiqueta que pueda separarse de Daniel 7, del reino, del padecimiento y de la resurrección. Tampoco es correcto convertir בן — ben en «heredero» o «repartidor» como si esa fuera su traducción fija en todas sus apariciones; las notas presentan esa relación como una lectura contextual y pedagógica."
          },
          "type": "concept"
        },
        "upstream_id": "concept:son-of-man"
      },
      {
        "id": "shaul:expression:bar-enash-ar",
        "kind": "expression",
        "names": {
          "und": "בר אנש"
        },
        "owner": "shaul",
        "provenance": {
          "locator": {
            "kind": "yaml",
            "pointer": ""
          },
          "origin": "authored",
          "publication": "draft",
          "review": "unreviewed",
          "source_id": "source:shaul-bar-enash-ar",
          "transformation": "normalized",
          "visibility": "public"
        },
        "source_record": {
          "aliases": [
            "bar enash"
          ],
          "id": "bar-enash-ar",
          "language": "aramaic",
          "script": "בר אנש",
          "transliteration": "Bar Enash",
          "type": "word"
        },
        "upstream_id": "word:bar-enash-ar"
      }
    ],
    "editions": [
      {
        "attribution": "Existing Davar OE dataset; retain its original source notices. Aramaic morphology is preserved.",
        "id": "oe",
        "language": "mul",
        "name": "OE Hebrew/Aramaic source",
        "owner": "davar",
        "reference_system_id": "davar-v1",
        "source_kind": "biblical_text",
        "source_revision": "ff2e1ad93eb2cea7407d5e93e14b5a532d16f602"
      }
    ],
    "evidence": [
      {
        "content": {
          "lemma": "בַּר",
          "source_entry_id": "H1247"
        },
        "id": "evidence:bdb:H1247",
        "kind": "lexical_entry",
        "provenance": {
          "locator": {
            "kind": "json",
            "pointer": "/H1247"
          },
          "origin": "source",
          "publication": "draft",
          "review": "unreviewed",
          "source_id": "source:bdb",
          "transformation": "normalized",
          "visibility": "public"
        },
        "targets": [
          {
            "kind": "external_lexical",
            "reference": {
              "code": "H1247",
              "namespace": "strong"
            }
          }
        ]
      },
      {
        "content": {
          "lemma": "אֱנָשׁ",
          "source_entry_id": "H606"
        },
        "id": "evidence:bdb:H606",
        "kind": "lexical_entry",
        "provenance": {
          "locator": {
            "kind": "json",
            "pointer": "/H606"
          },
          "origin": "source",
          "publication": "draft",
          "review": "unreviewed",
          "source_id": "source:bdb",
          "transformation": "normalized",
          "visibility": "public"
        },
        "targets": [
          {
            "kind": "external_lexical",
            "reference": {
              "code": "H606",
              "namespace": "strong"
            }
          }
        ]
      },
      {
        "content": {
          "entities": [
            "concept:son-of-man",
            "word:bar-enash-ar",
            "verse:daniel-7-13",
            "verse:daniel-7-14",
            "concept:ancient-of-days"
          ],
          "id": "mention-son-of-man-daniel",
          "location": {
            "heading": "Daniel 7:13-14"
          },
          "note": "besorah/marcos_ben_adam_metamorfosis_glosario",
          "text": "El Bar Enash que llega ante el Anciano de días recibe dominio, honra y reino."
        },
        "id": "shaul:evidence:mention-son-of-man-daniel",
        "kind": "mention",
        "provenance": {
          "locator": {
            "kind": "yaml",
            "pointer": ""
          },
          "origin": "authored",
          "publication": "draft",
          "review": "unreviewed",
          "source_id": "source:shaul-son-of-man-daniel",
          "transformation": "normalized",
          "visibility": "public"
        },
        "targets": [
          {
            "kind": "reference",
            "reference": {
              "book_id": "daniel",
              "chapter": 7,
              "kind": "verse",
              "system_id": "davar-v1",
              "verse": 13
            }
          }
        ]
      }
    ],
    "passages": [
      {
        "book_id": "daniel",
        "edition_id": "oe",
        "id": "passage:oe:daniel:7:69846562721f2e1a8c26e28111b2f8c8fe47dcffcba5ca602e4fd0b21ef732b9",
        "language": "arc",
        "mapping": {
          "status": "mapped",
          "targets": [
            {
              "book_id": "daniel",
              "chapter": 7,
              "kind": "verse",
              "system_id": "davar-v1",
              "verse": 13
            }
          ]
        },
        "native_reference": {
          "chapter": 7,
          "verse_label": "13"
        },
        "provenance": {
          "locator": {
            "kind": "json",
            "pointer": "/12"
          },
          "origin": "source",
          "publication": "draft",
          "review": "unreviewed",
          "source_id": "source:oe",
          "transformation": "normalized",
          "visibility": "public"
        },
        "text": "חָזֵ֤ה הֲוֵית֙ בְּ/חֶזְוֵ֣י לֵֽילְיָ֔/א וַ/אֲרוּ֙ עִם עֲנָנֵ֣י שְׁמַיָּ֔/א כְּ/בַ֥ר אֱנָ֖שׁ אָתֵ֣ה הֲוָ֑ה וְ/עַד עַתִּ֤יק יֽוֹמַיָּ/א֙ מְטָ֔ה וּ/קְדָמ֖וֹ/הִי הַקְרְבֽוּ/הִי",
        "text_snapshot": "69846562721f2e1a8c26e28111b2f8c8fe47dcffcba5ca602e4fd0b21ef732b9",
        "tokenization_policy": "source-array-v1"
      }
    ],
    "relations": [
      {
        "evidence_ids": [
          "shaul:evidence:mention-son-of-man-daniel"
        ],
        "id": "davar:relation:daniel-7-13-bar-enash",
        "object": {
          "id": "shaul:concept:son-of-man",
          "kind": "concept"
        },
        "owner": "davar",
        "predicate": "expresses_concept",
        "provenance": {
          "locator": {
            "kind": "json",
            "pointer": "/0"
          },
          "origin": "authored",
          "publication": "draft",
          "review": "unreviewed",
          "source_id": "source:authored-relations",
          "transformation": "normalized",
          "visibility": "public"
        },
        "scope": {
          "book_id": "daniel",
          "chapter": 7,
          "kind": "verse",
          "system_id": "davar-v1",
          "verse": 13
        },
        "subject": {
          "id": "span:passage:oe:daniel:7:69846562721f2e1a8c26e28111b2f8c8fe47dcffcba5ca602e4fd0b21ef732b9:9-10",